{
  "format_version": "gameplay-config-format-v1",
  "document_kind": "semantic-registry",
  "namespaces": [
    { "kind": "actor", "prefix": "actor/", "owner": "authority" },
    { "kind": "weapon", "prefix": "weapon/", "owner": "authority" },
    { "kind": "ability-grant", "prefix": "ability-grant/", "owner": "authority" },
    { "kind": "ability", "prefix": "ability/", "owner": "authority" },
    { "kind": "projectile", "prefix": "projectile/", "owner": "authority" },
    { "kind": "effect", "prefix": "effect/", "owner": "authority" },
    { "kind": "ai", "prefix": "ai/", "owner": "authority" },
    { "kind": "boss-phase", "prefix": "boss-phase/", "owner": "authority" },
    { "kind": "encounter", "prefix": "encounter/", "owner": "authority" },
    { "kind": "collision-layer", "prefix": "collision-layer/", "owner": "authority" },
    { "kind": "navigation-policy", "prefix": "navigation-policy/", "owner": "authority" },
    { "kind": "cue", "prefix": "cue/", "owner": "authority" },
    { "kind": "resource", "prefix": "resource/", "owner": "presentation" }
  ],
  "allowed_references": [
    { "from_kind": "actor", "field": "weapon-ref", "to_kinds": ["weapon"] },
    { "from_kind": "actor", "field": "ai-ref", "to_kinds": ["ai"] },
    { "from_kind": "actor", "field": "boss-phase-ref", "to_kinds": ["boss-phase"] },
    { "from_kind": "actor", "field": "cue-ref", "to_kinds": ["cue"] },
    { "from_kind": "weapon", "field": "grant-ref", "to_kinds": ["ability-grant"] },
    { "from_kind": "weapon", "field": "cue-ref", "to_kinds": ["cue"] },
    { "from_kind": "ability-grant", "field": "ability-ref", "to_kinds": ["ability"] },
    { "from_kind": "ability", "field": "projectile-ref", "to_kinds": ["projectile"] },
    { "from_kind": "ability", "field": "effect-ref", "to_kinds": ["effect"] },
    { "from_kind": "ability", "field": "cue-ref", "to_kinds": ["cue"] },
    { "from_kind": "projectile", "field": "effect-ref", "to_kinds": ["effect"] },
    { "from_kind": "projectile", "field": "collision-layer-ref", "to_kinds": ["collision-layer"] },
    { "from_kind": "projectile", "field": "cue-ref", "to_kinds": ["cue"] },
    { "from_kind": "effect", "field": "cue-ref", "to_kinds": ["cue"] },
    { "from_kind": "ai", "field": "ability-ref", "to_kinds": ["ability"] },
    { "from_kind": "ai", "field": "navigation-policy-ref", "to_kinds": ["navigation-policy"] },
    { "from_kind": "boss-phase", "field": "ai-ref", "to_kinds": ["ai"] },
    { "from_kind": "boss-phase", "field": "ability-ref", "to_kinds": ["ability"] },
    { "from_kind": "boss-phase", "field": "cue-ref", "to_kinds": ["cue"] },
    { "from_kind": "encounter", "field": "player-ref", "to_kinds": ["actor"] },
    { "from_kind": "encounter", "field": "monster-ref", "to_kinds": ["actor"] },
    { "from_kind": "encounter", "field": "boss-ref", "to_kinds": ["actor"] },
    { "from_kind": "encounter", "field": "collision-layer-ref", "to_kinds": ["collision-layer"] },
    { "from_kind": "encounter", "field": "navigation-policy-ref", "to_kinds": ["navigation-policy"] },
    { "from_kind": "navigation-policy", "field": "collision-layer-ref", "to_kinds": ["collision-layer"] }
  ],
  "retired_ids": []
}
